(Level 1) ,(Level 2),(Level 3),(Level 4),Unit Type,Defintion,CMECS Version,Component Code,Unit Code
Modifiers,Physicochemical Modifiers,Turbidity Provenance,Resuspended,CMECS Modifier Value,"Deposited materials mixed into the water column by currents (e.g., bottom sediments).",2012-06,,TP05
Modifiers,Physicochemical Modifiers,Turbidity Provenance,Terrigenous Origin,CMECS Modifier Value,"Materials, water, or energy in a water body resulting from land drainage or wind deposits.",2012-06,,TP06
Modifiers,Physicochemical Modifiers,Water Column Stability Regime,,CMECS Modifier,"Water column stability can be characterized as stratified, partially mixed, and well-mixed. This structure is defined by density differentials from bottom to surface, as shown in the table below. Water Column Stability is assessed using the more universally applied delta Sigma-t to calculate stability, which incorporates salinity, temperature into the calculation of density and adjusts for adiabatic effects (Pond and Pickard 1983). The Stability Regime modifier compares the calculated ? Sigma-t, or the relative density of two water parcels by subtraction of the density of the surface layer from the density of the deeper layer. If the density difference equals or exceeds 0.125, the water column is considered to be vertically stable; if it differs by less than 0.125, and density is homogeneous between the upper and lower layers, the water column is classified as well-mixed. If the density difference is less than 0.125 and variable between the two layers, the water column is classified as partially mixed.",2012-06,,WCS
Modifiers,Physicochemical Modifiers,Water Column Stability Regime,Partially Stratified,CMECS Modifier Value,< 0.125 ? sigma-t and variable,2012-06,,WCS01
Modifiers,Physicochemical Modifiers,Water Column Stability Regime,Stratified,CMECS Modifier Value,≥ 0.125 ? sigma-t,2012-06,,WCS02
Modifiers,Physicochemical Modifiers,Water Column Stability Regime,Well-Mixed,CMECS Modifier Value,< 0.125 ? sigma-t and homogeneous,2012-06,,WCS03
Modifiers,Spatial Modifers,,,CMECS Modifier Type,,2012-06,,
Modifiers,Spatial Modifers,Benthic Depth Zone,,CMECS Modifier,"The depths of benthic zones vary depending on regional geology and turbidity. It is often useful to describe a specific depth or range of depths for the bottom, and the CMECS Benthic Depth Zone Modifiers represent the major divisions in a gradient from land to the deep ocean bottom. They are generally based on the zones in which surf or ocean swell influences bottom communities, lower limits of vegetation (such as kelp), overall photic availability, and temperature. The zones within this category are drawn or adapted from Greene et al. (2007) and Connor (1997).",2012-06,,BDZ
Modifiers,Spatial Modifers,Benthic Depth Zone,Littoral,CMECS Modifier Value,Intertidal,2012-06,,BDZ01
Modifiers,Spatial Modifers,Benthic Depth Zone,Shallow Infralittoral,CMECS Modifier Value,0 to < 5 meters,2012-06,,BDZ02
Modifiers,Spatial Modifers,Benthic Depth Zone,Deep Infralittoral,CMECS Modifier Value,5 to < 30 meters,2012-06,,BDZ03
Modifiers,Spatial Modifers,Benthic Depth Zone,Circalittoral,CMECS Modifier Value,30 to < 200 meters,2012-06,,BDZ04
Modifiers,Spatial Modifers,Benthic Depth Zone,Mesobenthic,CMECS Modifier Value,"200 to < 1,000 meters",2012-06,,BDZ05
Modifiers,Spatial Modifers,Benthic Depth Zone,Bathybenthic,CMECS Modifier Value,"1,000 to < 4,000 meters",2012-06,,BDZ06
Modifiers,Spatial Modifers,Benthic Depth Zone,Abyssalbenthic,CMECS Modifier Value,"4,000 to < 6,000 meters",2012-06,,BDZ07
Modifiers,Spatial Modifers,Benthic Depth Zone,Hadalbenthic,CMECS Modifier Value,"≥ 6,000 meters",2012-06,,BDZ08
Modifiers,Spatial Modifers,Co-occurring Elements,Descriptive,CMECS Modifier,"Nature is inherently a mixture or a continuum. CMECS provides an ecologically meaningful methodology to classify nature into discrete environmental types using consistent threshold values that define primary classification units. However, in natural coastal and marine settings, less abundant, co-occurring (or secondary) features are frequently mixed into these primary classification types at some level beneath a classification threshold. Therefore, these co-occurring features are not recognized in the syntax of the primary classification. In some situations, project goals may require identification of these co-occurring features and associated taxa. In other situations, identification of co-occurring materials, taxa, or mixes may detract from project goals.
CMECS provides a modifier, Co-occurring Elements, for identification of secondary CMECS classification units that are mixed into a primary classification unit at a level below the classification threshold. Co-occurring Elements are used in the hierarchical Biotic and Substrate Components when the primary feature and the co-occurring feature are both units in that same Component. More information and examples of Co-occurring Elements can be found on page 213.",2012-06,,CoE
Modifiers,Spatial Modifers,Coral Reef Zone,,CMECS Modifier,"All coral reef environments contain distinct horizontal and vertical zones created by differences in depth, morphology, wave and current energy, temperature, and light. The following zones are commonly present on shallow and mesophotic reefs (Zitello et al. 2009).",2012-06,,CRZ
Modifiers,Spatial Modifers,Coral Reef Zone,Back Reef,CMECS Modifier Value,Area between the seaward edge of a lagoon floor and the landward edge of a reef crest. This zone is present only when a reef crest exists.,2012-06,,CRZ01
Modifiers,Spatial Modifers,Coral Reef Zone,Bank/Shelf,CMECS Modifier Value,"Deeper water area (usually > 30 meters) extending offshore from the seaward edge of the fore reef (or shoreline) to the beginning of the bank/shelf escarpment where the insular shelf drops off into deep, oceanic water.",2012-06,,CRZ02
Modifiers,Spatial Modifers,Coral Reef Zone,Bank/Shelf Escarpment,CMECS Modifier Value,"The edge of the bank/shelf where depth increases rapidly into deep oceanic water. This zone begins at approximately 20-30 meters depth, near the depth limit of features visible in aerial images. This zone extends well into depths exceeding those that can be seen on aerial photos, and this zone is intended to capture the transition from the bank/shelf to deep waters of the open ocean.",2012-06,,CRZ03
Modifiers,Spatial Modifers,Coral Reef Zone,Fore Reef,CMECS Modifier Value,Area from the seaward edge of the reef crests (which slopes into deeper water) to the landward edge of the bank/shelf platform. Features not forming an emergent reef crest- but still having a seaward-facing slope that is significantly greater than the slope of the bank/shelf- are also designated as forereef.,2012-06,,CRZ04
Modifiers,Spatial Modifers,Coral Reef Zone,Lagoon,CMECS Modifier Value,"Shallow area (relative to the deeper water of the bank/shelf) between the shoreline intertidal zone and a back reef or barrier island. This zone is protected from the high-energy waves commonly experienced on the bank/shelf and reef crest. If no reef crest is present, there is no lagoon zone.",2012-06,,CRZ05
Modifiers,Spatial Modifers,Coral Reef Zone,Reef Crest,CMECS Modifier Value,"The flattened, emergent (especially during low tides) or nearly emergent segment of a reef. This zone lies between the back reef and fore reef zones. In aerial images, breaking waves will often be visible at the seaward edge of this zone.",2012-06,,CRZ06
Modifiers,Spatial Modifers,Coral Reef Zone,Reef Flat,CMECS Modifier Value,Shallow (semi-exposed) area between the shoreline intertidal zone and the reef crest of a fringing reef. This zone is protected from the high-energy waves commonly experienced on the shelf and reef crest. Reef flat is typically not present if there is a lagoon zone.,2012-06,,CRZ07
Modifiers,Spatial Modifers,Coral Reef Zone,Ridges and Swales,CMECS Modifier Value,"An area of numerous thin, narrow, discontinuous bands of coral ridges and leeward sand- and sediment-filled swales. Debris and reef-rubble fields behind many of the reefs may obscure these margin-parallel seabed features. In Florida, for example, this zone extends for an estimated 200 kilometers along the Florida shelf (from Key Largo to Halfmoon Shoal), and it is discontinuous due to (a) topography, (b) inconsistent responses of coral reefs to changing sea levels, and (c) varying effects of the physical environment on reefs and sediments.",2012-06,,CRZ08
Modifiers,Spatial Modifers,Coral Reef Zone,Shoreline/Intertidal,CMECS Modifier Value,Area between the mean high water line (or the landward edge of emergent vegetation- such as Red Mangrove- when present) and the lowest spring tide level (excluding emergent segments of barrier reefs).,2012-06,,CRZ09
Modifiers,Spatial Modifers,Coral Reef Zone,Vertical Wall,CMECS Modifier Value,"Area with near-vertical slope from the shore to the shelf (or shelf escarpment). This zone is typically narrow and may not be distinguishable in remotely gathered imagery; however, it is included because it is recognized as a biologically important feature.",2012-06,,CRZ10
Modifiers,Spatial Modifers,Enclosure,,CMECS Modifier,"Enclosure represents the degree of isolation of a water body from other waters because of enclosure by a land mass. In estuaries, enclosure determines the degree of exchange of water, materials, energy, and biota between the estuary and the sea. More enclosed water bodies have longer water residence times, can tend to be more evaporative and hypersaline, and can more readily trap and retain materials within them.",2012-06,,E
Modifiers,Spatial Modifers,Enclosure,Unenclosed,CMECS Modifier Value,"≥ 150-degree angular gap from landward end of water body to seaward opening; no confining land masses (e.g., islands) within or just outside water body.",2012-06,,E01
Modifiers,Spatial Modifers,Enclosure,Partially enclosed,CMECS Modifier Value,90- to < 150-degree angular gap from landward end of water body to seaward opening.,2012-06,,E02
Modifiers,Spatial Modifers,Enclosure,Significantly enclosed,CMECS Modifier Value,45- to < 90-degree angular gap from landward end of water body to seaward opening.,2012-06,,E03
Modifiers,Spatial Modifers,Enclosure,Very enclosed,CMECS Modifier Value,10- to < 45-degree angular gap from landward end of water body to seaward opening.,2012-06,,E04
Modifiers,Spatial Modifers,Enclosure,Enclosed,CMECS Modifier Value,Essentially separated from the ocean; waters are completely surrounded by land or with a narrow channel connection to the sea. This category includes perched estuaries and lagoonal estuaries.,2012-06,,E05
Modifiers,Spatial Modifers,Enclosure,Intermittent,CMECS Modifier Value,"Class of water bodies that regularly close due to low flow, opening seasonally during high flow. Also called ICOLL (Intermittently Closed and Open Lake or Lagoon).",2012-06,,E06
Modifiers,Spatial Modifers,Percent Cover Range,,CMECS Modifier,"To classify a unit to the class and subclass level of the Biotic Component, a user needs to know the relative percent cover of each of the components of the substrate. The degree of substrate cover for each biotic feature is assessed using the following ranges. These categories can also be used as a modifier to describe the density of vegetation (such as seagrasses) or other substrate components, and are useful in the Substrate component as well. Coarse Percent Cover can be described using one of five coarse descriptors, e.g., ""Sparse"", or, if greater detail is needed, Fine Percent Cover can be described using one of eleven range categories, e.g., ""10 to < 20%"".",2012-06,,PC
Modifiers,Spatial Modifers,Fine Percent Cover Range,<1%,CMECS Modifier Value,,2012-06,,PC01
Modifiers,Spatial Modifers,Fine Percent Cover Range,1 to < 10%,CMECS Modifier Value,,2012-06,,PC02
Modifiers,Spatial Modifers,Fine Percent Cover Range,10 to < 20%,CMECS Modifier Value,,2012-06,,PC03
Modifiers,Spatial Modifers,Fine Percent Cover Range,20 to < 30%,CMECS Modifier Value,,2012-06,,PC04
Modifiers,Spatial Modifers,Fine Percent Cover Range,30 to < 40%,CMECS Modifier Value,,2012-06,,PC05
Modifiers,Spatial Modifers,Fine Percent Cover Range,40 to < 50%,CMECS Modifier Value,,2012-06,,PC06
Modifiers,Spatial Modifers,Fine Percent Cover Range,50 to < 60%,CMECS Modifier Value,,2012-06,,PC07
Modifiers,Spatial Modifers,Fine Percent Cover Range,60 to < 70%,CMECS Modifier Value,,2012-06,,PC08
Modifiers,Spatial Modifers,Fine Percent Cover Range,70 to < 80%,CMECS Modifier Value,,2012-06,,PC09
Modifiers,Spatial Modifers,Fine Percent Cover Range,80 to <  90%,CMECS Modifier Value,,2012-06,,PC10
Modifiers,Spatial Modifers,Fine Percent Cover Range,90 to 100%,CMECS Modifier Value,,2012-06,,PC11
Modifiers,Spatial Modifers,Coarse Percent Cover Range,Trace (< 1%),CMECS Modifier Value,,2012-06,,
Modifiers,Spatial Modifers,Coarse Percent Cover Range,Sparse (1 to < 30%),CMECS Modifier Value,,2012-06,,
Modifiers,Spatial Modifers,Coarse Percent Cover Range,Moderate (30 to < 70%),CMECS Modifier Value,,2012-06,,
Modifiers,Spatial Modifers,Coarse Percent Cover Range,Dense (70 to < 80%),CMECS Modifier Value,,2012-06,,
Modifiers,Spatial Modifers,Coarse Percent Cover Range,Complete (90 to 100%),CMECS Modifier Value,,2012-06,,
Modifiers,Spatial Modifers,Elevation Profile,,CMECS Modifier,The Profile Modifier refers to the elevation of a feature relative to the surrounding level of the water or bed.,2012-06,,P
Modifiers,Spatial Modifers,Elevation Profile,None,CMECS Modifier Value,0 meters,2012-06,,P01
Modifiers,Spatial Modifers,Elevation Profile,Low,CMECS Modifier Value,0.1 to < 2 meters,2012-06,,P02
Modifiers,Spatial Modifers,Elevation Profile,Medium,CMECS Modifier Value,2 to < 5 meters,2012-06,,P03
Modifiers,Spatial Modifers,Elevation Profile,High,CMECS Modifier Value,≥ 5 meters,2012-06,,P04
Modifiers,Spatial Modifers,Substrate Layering,Descriptive,CMECS Modifier,"Substrate in CMECS conceptually extends to the greatest depth that supports multicellular life. Although certain large fauna may penetrate several meters below the surface in soft sediments, CMECS generally considers the uppermost 15 centimeters of fine substrates, recognizing that evidence of very-deep burrowing fauna will also be present in the top 15 centimeters. The upper 15 centimeters of substrate may present as a set of horizontal layers constituting a three-dimensional matrix. A basic identification of horizontal substrate layers can be accomplished by describing the characteristics of these layers and recording the mean thickness in centimeters together with the ordering of each layer below the sediment surface. The process of identifying and describing substrate layers can provide ecological insights and practical value for users interested in substrate structure and process, as well as in ecological history.
The structuring of distinctly layered sediments is captured in CMECS as a modifier using any SC classifiers, modifiers, or descriptors in the following format, with measurements indicating thickness or depth of the examined layers (as specified). The term “veneer"" may be used to describe a thin (< 1 centimeter thick) covering of one sediment type over another sediment type. Examples can be found on page 219.",2012-06,,SL
