(Level 1) ,(Level 2),(Level 3),(Level 4),Unit Type,Defintion,CMECS Version,Component Code,Unit Code
Modifiers,Physical Modifiers,Small Scale Slope,Vertical,CMECS Modifier Value,60 to < 90 degrees,2012-06,,S04
Modifiers,Physical Modifiers,Small Scale Slope,Overhang,CMECS Modifier Value,≥ 90 degrees,2012-06,,S05
Modifiers,Physical Modifiers,Substrate Descriptor,,CMECS Modifier,"The Substrate Component describes substrate size and composition, considering substrate origin as Geologic, Biogenic, and Anthropogenic. The Geologic classifications follow Wentworth (1922) and Folk (1954) to describe particle sizes and mixes, but do not consider geologic composition or several other important attributes. Substrate descriptors provide consistent terminology to meet these needs. Certain substrate descriptors may be used for other applications as well, e.g., Well-Mixed, Patchy, and Well-Sorted can be used to describe biotic communities or other units.",2012-06,,SD
Modifiers,Physical Modifiers,Substrate Descriptor,Carbonate,CMECS Modifier Value,"Geologic Origin particles or substrates composed mainly of carbonate minerals, e.g., limestone, dolostone.",2012-06,,SD01
Modifiers,Physical Modifiers,Substrate Descriptor,Compacted,CMECS Modifier Value,"Unconsolidated sediments with very little water content and a hard, packed form that resists penetration and resuspension. This is one of several terms that are used in CMECS to describe the fluid consistency of substrates.",2012-06,,SD02
Modifiers,Physical Modifiers,Substrate Descriptor,Floc,CMECS Modifier Value,"A layer of very fine particles suspended in the water column just above firmer sediment. This is often most apparent with visual or imaging techniques, and may appear as a turbid or cloudy layer above a more defined sediment surface. This is one of several terms that are used in CMECS to describe the fluid consistency of substrates.",2012-06,,SD03
Modifiers,Physical Modifiers,Substrate Descriptor,Fluid,CMECS Modifier Value,"Substrate with high water content. When a palmful of sediment is squeezed in the hand, most or all flows through the fingers after full pressure (Schoeneberger et al. 2002). This is one of several terms that are used to describe the fluid consistency of substrates in CMECS.",2012-06,,SD04
Modifiers,Physical Modifiers,Substrate Descriptor,Gas,CMECS Modifier Value,"Subsurface bubbles of gas, possibly resulting from methanogenesis or other biogeochemical processes, are present. Escaping gas may or may not express at the sediment surface.",2012-06,,SD05
Modifiers,Physical Modifiers,Substrate Descriptor,Mobile,CMECS Modifier Value,"Bedded sediments which regularly resuspend and/or move with local hydrodynamics due to the density, grain size, shape, and/or high water content of the sediment, or due to the higher hydrodynamic energy experienced in the local area. This term is used in CMECS to describe or predict behavior of substrates.",2012-06,,SD06
Modifiers,Physical Modifiers,Substrate Descriptor,Non-Mobile,CMECS Modifier Value,"Bedded sediments which do not regularly resuspend and/or move with local hydrodynamics due to the density, grain size, shape, and/or compaction (low water content) of the sediment particles, or due to the lower hydrodynamic energy experienced in the local area. This term is used in CMECS to describe or predict behavior of substrates.",2012-06,,SD07
Modifiers,Physical Modifiers,Substrate Descriptor,Mud Clasts,CMECS Modifier Value,"Compacted or consolidated fragments (clumps, lumps, balls, shards, etc.) of mud or clay, typically occurring at the sediment surface, with diameters of millimeters to < 1 meter.",2012-06,,
Modifiers,Physical Modifiers,Substrate Descriptor,Patchy,CMECS Modifier Value,"Different elements within a sample, observational unit, or reporting unit are grouped into clusters or patches at the scale of the sample or unit. ""Patchy"" implies that clusters of elements or particles are arranged in a haphazard manner, as clusters of pebbles scattered on sand. This is one of several terms used in CMECS to describe unit variability.",2012-06,,SD08
Modifiers,Physical Modifiers,Substrate Descriptor,Pelagic Clay,CMECS Modifier Value,"Deep sea Geologic Substrates composed primarily of aeolian deposits, volcanic ash, and other non-biogenic materials that sink into the very deep oceans, or may be generated in the deep oceans. Pelagic Clays contain less than 30% ooze materials (tests, shells, and frustules of plankters) and are found in areas of low surface productivity.",2012-06,,SD09
Modifiers,Physical Modifiers,Substrate Descriptor,Red Clay,CMECS Modifier Value,"A type of Pelagic Clay composed primarily of aeolian dust, with various marine-generated particles mixed in (fish bones, teeth, authigenic mineral deposits). Red clays are distinguished by their characteristic bright red or brown color and are found in the deepest and most remote ocean areas. Red Clay contains less than 30% ooze materials.",2012-06,,SD10
Modifiers,Physical Modifiers,Substrate Descriptor,Siliciclastic,CMECS Modifier Value,"Geologic Substrate Origin particles or substrates composed primarily of silicate minerals e.g., quartz, sandstone, siltstone.",2012-06,,SD11
Modifiers,Physical Modifiers,Substrate Descriptor,Sulfidic,CMECS Modifier Value,"Substrate in which bacterial sulfate reduction is an important biogeochemical process; this generally occurs in anaerobic environments and is often identifiable by a very low reflectance black or blue color, and a characteristic ""rotten egg"" odor when sediments are examined in air.",2012-06,,SD12
Modifiers,Physical Modifiers,Substrate Descriptor,Volcaniclastic,CMECS Modifier Value,"Geologic Origin particles or substrates composed primarily of volcanic rock, crystals, glassy pumice, ash, or other volcanic products.",2012-06,,SD13
Modifiers,Physical Modifiers,Substrate Descriptor,Volcanic Ash,CMECS Modifier Value,"A substrate or substrate layer composed primarily of volcanic dust and volcanic ash, often with various aeolian or marine-generated particles mixed in. In areas of the deep sea, where terrigenous input and bioturbation are limited, Volcanic Ash may be present in distinct layers at depth in the substrate matrix (see the ""Layers"" modifier).",2012-06,,SD14
Modifiers,Physical Modifiers,Substrate Descriptor,Well-Mixed,CMECS Modifier Value,"Different elements within a sample, observational unit, or reporting unit are well-mixed or poorly-sorted at the scale of the sample or unit. Well-mixed implies that elements or particles are completely and relatively evenly intermingled, e.g., Granule/Sand/Mud particles in an area with high bioturbation. This is one of several terms used in CMECS to describe unit variability. Note that CMECS does not use the equivalent geological term ""Poorly-Sorted"", because the descriptor may be used to describe distributions of non-geological features (such as biological communities or Geoform Component structures).",2012-06,,SD15
Modifiers,Physical Modifiers,Substrate Descriptor,Well-Sorted,CMECS Modifier Value,"Different elements within a sample, observational unit, or reporting unit are separated into different areas at the scale of the sample or unit. Well-sorted implies that elements or particles are (or have been) separated and arranged in a non- haphazard manner, as an area of Coarse Sand adjacent to an area of Clay. This is one of several terms used in CMECS to describe unit variability.",2012-06,,SD16
Modifiers,Physical Modifiers,Surface Pattern,,CMECS Modifier,"The surface of the seafloor may be flat (on a scale of centimeters or meters), or it may be characterized by roughness or pattern. The Substrate Component describes substrate size and composition, while the Geoform Component describes texture or shape—including the Surface Pattern Modifier. These roughness patterns may have physical origins (e.g., caused by wave or current action) or biological origins (due to activities of life forms, e.g., mounds or tunnels). Physically influenced bedforms may appear as regularly spaced “sand ripples” (with a wavelength on the order of centimeters), which may be indicative of wave oscillations or of current flows. Physical energy in soft-sediment areas may occur through riverine flow or tidally driven flow, leading to erosion and deposition of mobile sediment layers.",2012-06,,SP
Modifiers,Physical Modifiers,Surface Pattern,Biological,CMECS Modifier Value,"Roughness appears due to bioturbation, fecal mounds, tunneling, feeding or locomotory activities of megafauna, or other faunal activities. Further characterization of biological features is described in the Biotic Component.",2012-06,,SP01
Modifiers,Physical Modifiers,Surface Pattern,Irregular,CMECS Modifier Value,"Sediment surface has a perceptible roughness or texture that is non-regular in either frequency, direction, or amplitude.",2012-06,,SP02
Modifiers,Physical Modifiers,Surface Pattern,Physical,CMECS Modifier Value,"Roughness appears due to water motion, but the nature of the roughness is other than Rippled.",2012-06,,SP03
Modifiers,Physical Modifiers,Surface Pattern,Rippled,CMECS Modifier Value,"Closely spaced, regular, repeating, vertical variations in the height of a sandy or muddy bottom, with a very short wavelength on the order of centimeters. A rippled substrate is generally caused by the physical processes of water motion.",2012-06,,SP04
Modifiers,Physical Modifiers,Surface Pattern,Scarred,CMECS Modifier Value,"Roughness appears due to localized sediment disturbance resulting either from natural causes (e.g., slumps) or anthropogenic causes (e.g., anchor scars, propeller scars, trawl scars, or other fishing gear scars), but not as an artifact of camera or sampling gear deployment.",2012-06,,SP05
Modifiers,Physical Modifiers,Surface Pattern,Smooth,CMECS Modifier Value,No perceptible roughness or texture to sediment surface at scales of less than 1 meter.,2012-06,,SP06
Modifiers,Physical Modifiers,Tidal Regime (Amplitude),,CMECS Modifier,The Tidal Regime Modifier refers to the height difference between mean high tide and mean low tide at the coast. The mean range gives a proxy for the energy and flow associated with tidal motions. Tidal Regime is shown in Table 10.15.,2012-06,,TR
Modifiers,Physical Modifiers,Tidal Regime (Amplitude),Atidal,CMECS Modifier Value,< 0.1 meter,2012-06,,TR01
Modifiers,Physical Modifiers,Tidal Regime (Amplitude),Microtidal,CMECS Modifier Value,0.1 to < 0.3 meter,2012-06,,TR02
Modifiers,Physical Modifiers,Tidal Regime (Amplitude),Minimally Tidal,CMECS Modifier Value,0.3 to < 1 meter,2012-06,,TR03
Modifiers,Physical Modifiers,Tidal Regime (Amplitude),Moderately Tidal,CMECS Modifier Value,1 to < 4 meters,2012-06,,TR04
Modifiers,Physical Modifiers,Tidal Regime (Amplitude),Macrotidal,CMECS Modifier Value,4 to < 8 meters,2012-06,,TR05
Modifiers,Physical Modifiers,Tidal Regime (Amplitude),Megatidal,CMECS Modifier Value,≥ 8 meters,2012-06,,TR06
Modifiers,Physical Modifiers,Wave Regime (Amplitude),,CMECS Modifier,"This modifier is intended to quantify intensity of wave energy by amplitude, and can be applied on any time scale, as specified by the user.",2012-06,,WR
Modifiers,Physical Modifiers,Wave Regime (Amplitude),Quiescent,CMECS Modifier Value,< 0.1 meter,2012-06,,WR01
Modifiers,Physical Modifiers,Wave Regime (Amplitude),Very Low Wave Energy,CMECS Modifier Value,0.1 to < 0.25 meter,2012-06,,WR02
Modifiers,Physical Modifiers,Wave Regime (Amplitude),Low Wave Energy,CMECS Modifier Value,0.25 to < 1.0 meter,2012-06,,WR03
Modifiers,Physical Modifiers,Wave Regime (Amplitude),Moderate Wave Energy,CMECS Modifier Value,1.0 to < 2.0 meters,2012-06,,WR04
Modifiers,Physical Modifiers,Wave Regime (Amplitude),Moderately High Wave Energy,CMECS Modifier Value,2.0 to < 4.0 meters,2012-06,,WR05
Modifiers,Physical Modifiers,Wave Regime (Amplitude),High Wave Energy,CMECS Modifier Value,4.0 to < 8.0 meters,2012-06,,WR06
Modifiers,Physical Modifiers,Wave Regime (Amplitude),Very High Wave Energy,CMECS Modifier Value,≥ 8.0 meters,2012-06,,WR07
Modifiers,Physicochemical Modifiers,,,CMECS Modifier Type,,2012-06,,
Modifiers,Physicochemical Modifiers,Oxygen Regime,,CMECS Modifier,"Oxygen concentration is an important water column modifier. Oxygen is critical to aerobic organisms and to aerobic processes (such as chemical oxidation and microbial respiration). Dissolved oxygen levels change daily in a dramatic way in systems such as estuaries, where they often go from hypoxic (at night) to saturated (during the day). The Oxygen Regime Modifier is intended for use in reporting persistent oxygen conditions, or can be used to explain variable regimes as described by the user. Oxygen levels are determined according to the following ranges, for the time scales and durations specified by the user; practitioners may specify, e.g., “oxygen varies from highly oxic during daylight hours to severely hypoxic at night”. Furthermore, practitioners should note that oxygen saturation varies with temperature and pressure.",2012-06,,OR
Modifiers,Physicochemical Modifiers,Oxygen Regime,Anoxic,CMECS Modifier Value,0 to < 0.1 mg/L,2012-06,,OR001
Modifiers,Physicochemical Modifiers,Oxygen Regime,Severely Hypoxic,CMECS Modifier Value,0.1 to < 2 mg/L,2012-06,,OR002
Modifiers,Physicochemical Modifiers,Oxygen Regime,Hypoxic,CMECS Modifier Value,2 to < 4 mg/L,2012-06,,OR003
Modifiers,Physicochemical Modifiers,Oxygen Regime,Oxic,CMECS Modifier Value,4 to < 8 mg/L,2012-06,,OR004
Modifiers,Physicochemical Modifiers,Oxygen Regime,Highly Oxic,CMECS Modifier Value,8 to < 12 mg/L,2012-06,,OR005
Modifiers,Physicochemical Modifiers,Oxygen Regime,Very Oxic,CMECS Modifier Value,≥ 12 mg/L,2012-06,,OR006
Modifiers,Physicochemical Modifiers,Photic Quality,,CMECS Modifier,"Photic quality is a highly variable parameter. In many cases, water is clear and downwelling light penetration extends the photic zone to the bottom of the water column. In cases of reduced water clarity, light is highly attenuated. Photic exposure depends on the depth, sun angle, cloud cover, time of year, and other factors. Moreover, the depth of the shift from photic to aphotic occurs at different points in the water column, depending on the ecosystem, watershed, and suspended substances reducing water clarity.
Vertical zones are evaluated relative to the penetration of light (photic and aphotic) for both water column and benthic components. The depth of the photic zone can also be calculated from ocean color imagery using satellite algorithms (Lee et al. 2007).",2012-06,,PQ
Modifiers,Physicochemical Modifiers,Photic Quality,Aphotic,CMECS Modifier Value,"Region of the water column where no ambient light penetrates, no photosynthesis occurs, and animals cannot make use of visual cues based on even reduced levels of ambient light. In oceans, this zone typically lies below 500-1,000 meters of depth. In turbid estuaries, this zone may be very shallow.",2012-06,,PQ01
Modifiers,Physicochemical Modifiers,Photic Quality,Dysphotic,CMECS Modifier Value,"Region of the water column, below the compensation depth, that receives less than 2% of the surface light; plants and algae cannot achieve positive photosynthetic production in this region, but some ambient light does penetrate such that animals can make use of visual cues based on reduced levels of ambient light.",2012-06,,PQ02
Modifiers,Physicochemical Modifiers,Photic Quality,Photic ,CMECS Modifier Value,Region of the water column where ambient light is > 2% of surface light and phototrophic organisms can photosynthesize.,2012-06,,PQ03
Modifiers,Physicochemical Modifiers,Photic Quality,Seasonally Photic,CMECS Modifier Value,An area that regularly varies between photic and dysphotic/aphotic.,2012-06,,PQ04
Modifiers,Physicochemical Modifiers,aRPD and RPD Depth,,CMECS Modifier,"The apparent Redox Potential Discontinuity (aRPD) is a measurement of the depth of the “color break,” that is, the maximum color difference below the sediment-water interface at which lighter-colored (tan, brown, beige, yellow, or red), more-oxidized surface sediments transition into darker-colored (grey, black, or blue-black), more-reduced deeper sediments. The depth of the aRPD is easily measured, and it has been found to be an extremely useful parameter in characterizing certain biogeochemical aspects of the sedimentary environment. For instance, the aRPD represents the depth at which iron exists as colored, insoluble, ferric hydroxides, which dissolve into solution as iron monosulfides in a reducing environment, e.g., in the presence of sulfate reduction (Teal et al. 2009).
The aRPD is strongly correlated to the true RPD depth (Grizzle and Penniman 1991; Rosenberg et al. 2001), which is the depth where Eh (measured sediment reduction/oxidation potential) is zero. Both values are very useful as proxies for bioturbation (because the values are extended deeper by the effects of bioturbating fauna), and both are correlated to bottom-water dissolved-oxygen concentration (Rosenberg 1977; Diaz, Cutter, and Rhoads 1994; Cicchetti et al. 2006). The aRPD can be measured with a variety of techniques including retrieval of cores, sediment profile imaging, and direct observation. The RPD can be measured using microelectrodes, either in retrieved cores or <in situ>.

RPD (centimeters) – The RPD is measured with electrodes, and is reported in centimeters.
aRPD depth (centimeters), muddy sediments – The aRPD depth is measured at the color transition based on direct observation or from images, and it can be reported in centimeters or following the terms defined below (from Nilsson and Rosenberg 1997). These modifier terms apply only to sediments that contain some mud; aRPD depths manifest differently in sand sediments that are dominated by different diffusional processes and rates.",2012-06,,RPD
Modifiers,Physicochemical Modifiers,aRPD and RPD Depth,Zero,CMECS Modifier Value,0.0 cm depth,2012-06,,RPD01
Modifiers,Physicochemical Modifiers,aRPD and RPD Depth,Diffusional,CMECS Modifier Value,> 0.0 to 1.0 cm depth,2012-06,,RPD02
Modifiers,Physicochemical Modifiers,aRPD and RPD Depth,Shallow,CMECS Modifier Value,> 1.0 to 2.0 cm depth,2012-06,,RPD03
Modifiers,Physicochemical Modifiers,aRPD and RPD Depth,Moderate,CMECS Modifier Value,> 2.0 to 3.5 cm depth,2012-06,,RPD04
Modifiers,Physicochemical Modifiers,aRPD and RPD Depth,Deep,CMECS Modifier Value,> 3.5 to 5.0 cm depth,2012-06,,RPD05
Modifiers,Physicochemical Modifiers,aRPD and RPD Depth,Very Deep,CMECS Modifier Value,> 5 cm depth,2012-06,,RPD06
Modifiers,Physicochemical Modifiers,Salinity Regime,,CMECS Modifier,"Salinity is considered a classifier for the Water Column Component, i.e., it is an essential parameter for measurement in order to effectively classify the water column. However, users may wish to apply the CMECS terminology for salinity within other components when the water column itself is not being classified. The salinity ranges are repeated here in the modifier section to allow this convenience for users.",2012-06,,SR
Modifiers,Physicochemical Modifiers,Salinity Regime,Oligohaline,CMECS Modifier Value,< 5,2012-06,,SR01
Modifiers,Physicochemical Modifiers,Salinity Regime,Mesohaline,CMECS Modifier Value,5 to < 18,2012-06,,SR02
Modifiers,Physicochemical Modifiers,Salinity Regime,Lower Polyhaline,CMECS Modifier Value,18 to < 25,2012-06,,SR03
Modifiers,Physicochemical Modifiers,Salinity Regime,Upper Polyhaline,CMECS Modifier Value,25 to < 30,2012-06,,SR04
Modifiers,Physicochemical Modifiers,Salinity Regime,Euhaline,CMECS Modifier Value,30 to < 40,2012-06,,SR05
Modifiers,Physicochemical Modifiers,Salinity Regime,Hyperhaline,CMECS Modifier Value,≥ 40,2012-06,,SR06
Modifiers,Physicochemical Modifiers,Temperature Range,,CMECS Modifier,"As with salinity, temperature is considered a classifier for the Water Column Component, i.e., it is an essential parameter for measurement in order to effectively classify the water column. Likewise, users may wish to apply the CMECS terminology for temperature within other components when the water column itself is not being classified. The temperature ranges are repeated here in the modifier section to allow this convenience for users.",2012-06,,T
Modifiers,Physicochemical Modifiers,Temperature Range,Frozen/Superchilled,CMECS Modifier Value,≤ 0 °C,2012-06,,T01
Modifiers,Physicochemical Modifiers,Temperature Range,Very Cold,CMECS Modifier Value,0 to < 5 °C (liquid),2012-06,,T02
Modifiers,Physicochemical Modifiers,Temperature Range,Cold,CMECS Modifier Value,5 to < 10 °C,2012-06,,T03
Modifiers,Physicochemical Modifiers,Temperature Range,Cool,CMECS Modifier Value,10 to < 15 °C,2012-06,,T04
Modifiers,Physicochemical Modifiers,Temperature Range,Moderate,CMECS Modifier Value,15 to < 20 °C,2012-06,,T05
Modifiers,Physicochemical Modifiers,Temperature Range,Warm,CMECS Modifier Value,20 to < 25 °C,2012-06,,T06
Modifiers,Physicochemical Modifiers,Temperature Range,Very Warm,CMECS Modifier Value,25 to < 30 °C,2012-06,,T07
Modifiers,Physicochemical Modifiers,Temperature Range,Hot,CMECS Modifier Value,30 to < 35 °C,2012-06,,T08
Modifiers,Physicochemical Modifiers,Temperature Range,Very Hot,CMECS Modifier Value,≥ 35 °C,2012-06,,T09
Modifiers,Physicochemical Modifiers,Turbidity,,CMECS Modifier,"Turbidity is a factor of the suspended solids and color within the water column, and it affects light attenuation and the depth to which light penetrates in the water column. This is critically important for autotrophs that convert light to photosynthetic products. Turbidity also has important effects on visual hunting and predation avoidance. While turbidity is frequently reported in Nephelometric Turbidity Units (NTUs), CMECS establishes categories for turbidity based on Secchi disk depth; it would be difficult to standardize turbidity by NTUs due to regional variations in background measurements. Secchi disk observations are commonly used in the marine environment.",2012-06,,TC
Modifiers,Physicochemical Modifiers,Turbidity,Extremely Turbid,CMECS Modifier Value,< 1 m Secchi depth,2012-06,,TC01
Modifiers,Physicochemical Modifiers,Turbidity,Highly Turbid,CMECS Modifier Value,1 to < 2 m Secchi depth,2012-06,,TC02
Modifiers,Physicochemical Modifiers,Turbidity,Moderately Turbid,CMECS Modifier Value,2 to < 5 m Secchi depth,2012-06,,TC03
Modifiers,Physicochemical Modifiers,Turbidity,Clear,CMECS Modifier Value,5 to < 20 m Secchi depth,2012-06,,TC04
Modifiers,Physicochemical Modifiers,Turbidity,Extremely Clear,CMECS Modifier Value,≥ 20 m Secchi depth,2012-06,,TC05
Modifiers,Physicochemical Modifiers,Turbidity Type,,CMECS Modifier,"The provenance of the attenuating substance?whether the reduced water clarity is derived from chlorophyll pigments (e.g., phytoplankton blooms), from color due to dissolved substances in the water (e.g., gelbstoff or tannins), from imported mineral terrigenous sediments, or from carbonate particulates in resuspension—is an important qualitative characteristic of turbidity. This qualitative assessment can be used in addition to a qualitative or quantitative evaluation of the degree of turbidity in the water column.",2012-06,,TT
Modifiers,Physicochemical Modifiers,Turbidity Type,Carbonate Particulates,CMECS Modifier Value,"Attenuation produced by suspended precipitated CaCO3 in the water column, generally creating an opaque ""milky"" appearance.",2012-06,,TT01
Modifiers,Physicochemical Modifiers,Turbidity Type,Chlorophyll,CMECS Modifier Value,"Attenuation produced by chlorophyll a, b, c, or d as constituents of live phytoplankton in the water column.",2012-06,,TT02
Modifiers,Physicochemical Modifiers,Turbidity Type,Colloidal Precipitates,CMECS Modifier Value,Dispersed particulates that precipitate out of the water to form aggregations such as marine snow.,2012-06,,TT03
Modifiers,Physicochemical Modifiers,Turbidity Type,Mineral Precipitates,CMECS Modifier Value,Attenuation produced by suspended inorganic sediments derived from soil and rock weathering.,2012-06,,TT04
Modifiers,Physicochemical Modifiers,Turbidity Type,Detritus,CMECS Modifier Value,Attenuation due to larger particles of organic detritus in suspension.,2012-06,,TT05
Modifiers,Physicochemical Modifiers,Turbidity Type,Dissolved Color,CMECS Modifier Value,Substances dissolved in water that have color.,2012-06,,TT06
Modifiers,Physicochemical Modifiers,Turbidity Type,Mixed,CMECS Modifier Value,Attenuation due to a variety of the above sources and substances.,2012-06,,TT07
Modifiers,Physicochemical Modifiers,Turbidity Provenance,,CMECS Modifier,"The provenance of the attenuating substance?whether the reduced water clarity is derived from chlorophyll pigments (e.g., phytoplankton blooms), from color due to dissolved substances in the water (e.g., gelbstoff or tannins), from imported mineral terrigenous sediments, or from carbonate particulates in resuspension—is an important qualitative characteristic of turbidity. This qualitative assessment can be used in addition to a qualitative or quantitative evaluation of the degree of turbidity in the water column.",2012-06,,TP
Modifiers,Physicochemical Modifiers,Turbidity Provenance,Allochthonous,CMECS Modifier Value,Originating outside of the system and transported into the system.,2012-06,,TP01
Modifiers,Physicochemical Modifiers,Turbidity Provenance,Autochthonous,CMECS Modifier Value,"Generated <in situ> by biogenic processes (e.g., phytoplankton bloom).",2012-06,,TP02
Modifiers,Physicochemical Modifiers,Turbidity Provenance,Marine Origin,CMECS Modifier Value,"Materials, water, or energy originating in the ocean.",2012-06,,TP03
Modifiers,Physicochemical Modifiers,Turbidity Provenance,Precipitated,CMECS Modifier Value,Solutes such as calcium carbonate that precipitate out of solution.,2012-06,,TP04
